{
 "format": "amg-forms",
 "v": 1,
 "tag": "forms-1dcfcd2c-4x15",
 "what": "The classes of functional form this bench enumerates over. A member is an EXPRESSION in the bench grammar with X for what the term reads, so an engine in any language can run it; the grammar is + - * / ** and exp log min max, and nothing else. Every member is normalised at both ends on purpose: otherwise swapping one moves magnitude and shape at once, and a failed proposition cannot be attributed to either.",
 "properties": [
  "increasing",
  "concave",
  "convex",
  "sigmoid",
  "f(0)=0",
  "f(1)=1"
 ],
 "families": [
  {
   "family": "concave",
   "properties": [
    "concave",
    "f(0)=0",
    "f(1)=1",
    "increasing"
   ],
   "members": [
    {
     "name": "cbrt",
     "expr": "X ** (1 / 3)"
    },
    {
     "name": "exponential",
     "expr": "(1 - exp(-2 * X)) / (1 - exp(-2))"
    },
    {
     "name": "hyperbolic",
     "expr": "2 * X / (1 + X)"
    },
    {
     "name": "log",
     "expr": "log(1 + 4 * X) / log(5)"
    },
    {
     "name": "sqrt",
     "expr": "X ** 0.5"
    }
   ]
  },
  {
   "family": "convex",
   "properties": [
    "convex",
    "f(0)=0",
    "f(1)=1",
    "increasing"
   ],
   "members": [
    {
     "name": "cubic",
     "expr": "X ** 3"
    },
    {
     "name": "exponential",
     "expr": "(exp(2 * X) - 1) / (exp(2) - 1)"
    },
    {
     "name": "quadratic",
     "expr": "X * X"
    },
    {
     "name": "quartic",
     "expr": "X ** 4"
    }
   ]
  },
  {
   "family": "linear",
   "properties": [
    "f(0)=0",
    "f(1)=1",
    "increasing",
    "linear"
   ],
   "members": [
    {
     "name": "proportional",
     "expr": "X"
    }
   ]
  },
  {
   "family": "sigmoid",
   "properties": [
    "f(0)=0",
    "f(1)=1",
    "increasing",
    "sigmoid"
   ],
   "members": [
    {
     "name": "algebraic",
     "expr": "X ** 3 / (X ** 3 + (1 - X) ** 3)"
    },
    {
     "name": "logistic",
     "expr": "(1 / (1 + exp(-11 * (X - 0.4))) - 1 / (1 + exp(4.4))) / (1 / (1 + exp(-6.6)) - 1 / (1 + exp(4.4)))"
    },
    {
     "name": "logistic_late",
     "expr": "(1 / (1 + exp(-8 * (X - 0.55))) - 1 / (1 + exp(4.4))) / (1 / (1 + exp(-3.6)) - 1 / (1 + exp(4.4)))"
    },
    {
     "name": "smootherstep",
     "expr": "X ** 3 * (X * (6 * X - 15) + 10)"
    },
    {
     "name": "smoothstep",
     "expr": "X * X * (3 - 2 * X)"
    }
   ]
  }
 ],
 "counts": {
  "families": 4,
  "members": 15
 }
}
